{
 "version": "1.0",
 "truncation": null,
 "padding": null,
 "added_tokens": [
  {
   "id": 0,
   "content": "<unk>",
   "single_word": false,
   "lstrip": false,
   "rstrip": false,
   "normalized": false,
   "special": true
  }
 ],
 "normalizer": null,
 "pre_tokenizer": {
  "type": "Metaspace",
  "replacement": "▁",
  "prepend_scheme": "always",
  "split": true
 },
 "post_processor": null,
 "decoder": {
  "type": "Metaspace",
  "replacement": "▁",
  "prepend_scheme": "always",
  "split": true
 },
 "model": {
  "type": "Unigram",
  "unk_id": 0,
  "vocab": [
   [
    "<unk>",
    0.0
   ],
   [
    "▁",
    -2.046889543533325
   ],
   [
    ",",
    -3.147214651107788
   ],
   [
    ".",
    -3.2545952796936035
   ],
   [
    "▁the",
    -3.3167929649353027
   ],
   [
    "▁a",
    -3.5587310791015625
   ],
   [
    "s",
    -3.705018997192383
   ],
   [
    "e",
    -3.752488136291504
   ],
   [
    "nd",
    -4.027560710906982
   ],
   [
    "t",
    -4.066613674163818
   ],
   [
    "y",
    -4.161077499389648
   ],
   [
    "ed",
    -4.220201015472412
   ],
   [
    "▁Pip",
    -4.470522880554199
   ],
   [
    ":",
    -4.581630706787109
   ],
   [
    "re",
    -4.607817649841309
   ],
   [
    "'",
    -4.658513069152832
   ],
   [
    "▁\"",
    -4.6726908683776855
   ],
   [
    "l",
    -4.718868732452393
   ],
   [
    "▁was",
    -4.806882858276367
   ],
   [
    "at",
    -4.9206976890563965
   ],
   [
    "▁The",
    -4.9626545906066895
   ],
   [
    "d",
    -4.965602397918701
   ],
   [
    "▁count",
    -4.982936382293701
   ],
   [
    "\"",
    -5.018973350524902
   ],
   [
    "n",
    -5.102442741394043
   ],
   [
    "ll",
    -5.13369083404541
   ],
   [
    "u",
    -5.151793003082275
   ],
   [
    "▁Mia",
    -5.192217826843262
   ],
   [
    "▁said",
    -5.192217826843262
   ],
   [
    "of",
    -5.195552825927734
   ],
   [
    "o",
    -5.211635112762451
   ],
   [
    "▁s",
    -5.268784999847412
   ],
   [
    "ck",
    -5.3116774559021
   ],
   [
    "r",
    -5.374242782592773
   ],
   [
    "▁m",
    -5.378135681152344
   ],
   [
    "ing",
    -5.4391350746154785
   ],
   [
    "w",
    -5.474854469299316
   ],
   [
    ".\"",
    -5.524326324462891
   ],
   [
    "er",
    -5.535824298858643
   ],
   [
    "▁to",
    -5.622386455535889
   ],
   [
    "▁sea",
    -5.626914978027344
   ],
   [
    "i",
    -5.665083885192871
   ],
   [
    "▁1,",
    -5.670297622680664
   ],
   [
    "f",
    -5.681073188781738
   ],
   [
    "2",
    -5.690359115600586
   ],
   [
    "▁i",
    -5.71571159362793
   ],
   [
    "▁I",
    -5.789615154266357
   ],
   [
    "orn",
    -5.826835632324219
   ],
   [
    "om",
    -5.827861309051514
   ],
   [
    "▁he",
    -5.8293256759643555
   ],
   [
    "box",
    -5.829618453979492
   ],
   [
    "c",
    -5.833458423614502
   ],
   [
    "▁in",
    -5.835784435272217
   ],
   [
    "a",
    -5.847445964813232
   ],
   [
    "▁it",
    -5.850615501403809
   ],
   [
    "▁we",
    -5.851356029510498
   ],
   [
    "▁1",
    -5.852586269378662
   ],
   [
    "▁th",
    -5.860084056854248
   ],
   [
    "▁one",
    -5.926355838775635
   ],
   [
    "▁c",
    -5.9310302734375
   ],
   [
    "ay",
    -5.981344223022461
   ],
   [
    "on",
    -6.010105133056641
   ],
   [
    "h",
    -6.013239860534668
   ],
   [
    "▁r",
    -6.030744552612305
   ],
   [
    "ch",
    -6.053127765655518
   ],
   [
    "▁pe",
    -6.075321674346924
   ],
   [
    "é",
    -6.076741695404053
   ],
   [
    "▁lighthouse",
    -6.076741695404053
   ],
   [
    "▁be",
    -6.076743125915527
   ],
   [
    "▁wood",
    -6.076772212982178
   ],
   [
    "▁la",
    -6.0782551765441895
   ],
   [
    "▁ships",
    -6.081060886383057
   ],
   [
    "own",
    -6.084941387176514
   ],
   [
    "ar",
    -6.085602760314941
   ],
   [
    "ou",
    -6.09014892578125
   ],
   [
    "▁g",
    -6.091686248779297
   ],
   [
    "ull",
    -6.093389987945557
   ],
   [
    "▁4",
    -6.102285861968994
   ],
   [
    "▁but",
    -6.104417324066162
   ],
   [
    "obot",
    -6.1180291175842285
   ],
   [
    "▁st",
    -6.1598029136657715
   ],
   [
    "ve",
    -6.181449890136719
   ],
   [
    "m",
    -6.1837568283081055
   ],
   [
    "▁on",
    -6.185174465179443
   ],
   [
    "te",
    -6.1885151863098145
   ],
   [
    "en",
    -6.200884819030762
   ],
   [
    "▁f",
    -6.268919944763184
   ],
   [
    "▁co",
    -6.269085884094238
   ],
   [
    "1",
    -6.276399612426758
   ],
   [
    "▁2",
    -6.284008979797363
   ],
   [
    "th",
    -6.306117534637451
   ],
   [
    "one",
    -6.3600592613220215
   ],
   [
    "-",
    -6.3924055099487305
   ],
   [
    "T",
    -6.406797885894775
   ],
   [
    "very",
    -6.406841278076172
   ],
   [
    "▁an",
    -6.40706205368042
   ],
   [
    "▁3",
    -6.40883731842041
   ],
   [
    "(",
    -6.410074234008789
   ],
   [
    "▁ba",
    -6.410074710845947
   ],
   [
    "▁baker",
    -6.410074710845947
   ],
   [
    ")",
    -6.4100751876831055
   ],
   [
    "?",
    -6.4100751876831055
   ],
   [
    "z",
    -6.4100751876831055
   ],
   [
    "▁On",
    -6.4100751876831055
   ],
   [
    "▁br",
    -6.4100751876831055
   ],
   [
    "▁like",
    -6.4100751876831055
   ],
   [
    "▁logbook",
    -6.4100751876831055
   ],
   [
    "▁total",
    -6.410076141357422
   ],
   [
    "▁over",
    -6.410080909729004
   ],
   [
    "▁door",
    -6.410090446472168
   ],
   [
    "▁numbers",
    -6.410277843475342
   ],
   [
    "▁old",
    -6.410542964935303
   ],
   [
    "▁up",
    -6.410648345947266
   ],
   [
    "▁lock",
    -6.4108052253723145
   ],
   [
    "▁shells",
    -6.411269664764404
   ],
   [
    "for",
    -6.412142276763916
   ],
   [
    "ope",
    -6.412168502807617
   ],
   [
    "▁did",
    -6.412382125854492
   ],
   [
    "▁every",
    -6.413920879364014
   ],
   [
    "▁fi",
    -6.415731430053711
   ],
   [
    "went",
    -6.420815467834473
   ],
   [
    "au",
    -6.423654079437256
   ],
   [
    "▁sh",
    -6.424863815307617
   ],
   [
    "▁gre",
    -6.427226543426514
   ],
   [
    "thing",
    -6.437448978424072
   ],
   [
    "per",
    -6.440966606140137
   ],
   [
    "lo",
    -6.444471836090088
   ],
   [
    "▁fou",
    -6.449499130249023
   ],
   [
    "ass",
    -6.451601028442383
   ],
   [
    "▁them",
    -6.466870307922363
   ],
   [
    "▁pr",
    -6.479738712310791
   ],
   [
    "▁w",
    -6.489006996154785
   ],
   [
    "▁They",
    -6.492379188537598
   ],
   [
    "It",
    -6.50299596786499
   ],
   [
    "ow",
    -6.5884833335876465
   ],
   [
    "▁wi",
    -6.632170677185059
   ],
   [
    "int",
    -6.6338629722595215
   ],
   [
    "ter",
    -6.693479061126709
   ],
   [
    "p",
    -6.704941749572754
   ],
   [
    "▁bo",
    -6.713720321655273
   ],
   [
    "es",
    -6.747879981994629
   ],
   [
    "=",
    -6.750923156738281
   ],
   [
    "▁ro",
    -6.842865943908691
   ],
   [
    "5",
    -6.843540668487549
   ],
   [
    "9",
    -6.856838226318359
   ],
   [
    "x",
    -6.8624348640441895
   ],
   [
    "od",
    -6.868121147155762
   ],
   [
    "▁t",
    -6.876583576202393
   ],
   [
    "▁ke",
    -6.889801025390625
   ],
   [
    "ma",
    -6.890285015106201
   ],
   [
    "▁pick",
    -6.8934807777404785
   ],
   [
    "ame",
    -6.89952278137207
   ],
   [
    "▁ne",
    -6.903509140014648
   ],
   [
    "0",
    -6.907368183135986
   ],
   [
    "L",
    -6.910073757171631
   ],
   [
    "ook",
    -6.910073757171631
   ],
   [
    "8",
    -6.9100751876831055
   ],
   [
    "j",
    -6.9100751876831055
   ],
   [
    "▁06:30",
    -6.9100751876831055
   ],
   [
    "▁He",
    -6.9100751876831055
   ],
   [
    "▁St",
    -6.9100751876831055
   ],
   [
    "▁books",
    -6.9100751876831055
   ],
   [
    "▁cake",
    -6.9100751876831055
   ],
   [
    "▁climbed",
    -6.9100751876831055
   ],
   [
    "▁harbor",
    -6.9100751876831055
   ],
   [
    "▁hundred",
    -6.9100751876831055
   ],
   [
    "▁stairs",
    -6.9100751876831055
   ],
   [
    "。",
    -6.9100751876831055
   ],
   [
    "小",
    -6.9100751876831055
   ],
   [
    "数",
    -6.9100751876831055
   ],
   [
    "船",
    -6.9100751876831055
   ],
   [
    "024",
    -6.910075664520264
   ],
   [
    "▁daughter",
    -6.910076141357422
   ],
   [
    "7",
    -6.91007661819458
   ],
   [
    "▁peppers",
    -6.91007661819458
   ],
   [
    "F",
    -6.9100775718688965
   ],
   [
    "▁steps",
    -6.9100775718688965
   ],
   [
    "turn",
    -6.9100799560546875
   ],
   [
    "nside",
    -6.910085678100586
   ],
   [
    "▁note",
    -6.910088539123535
   ],
   [
    "000,",
    -6.9101881980896
   ],
   [
    "▁sun",
    -6.910483360290527
   ],
   [
    "▁dog",
    -6.910547256469727
   ],
   [
    "eep",
    -6.910970687866211
   ],
   [
    "Wh",
    -6.911235332489014
   ],
   [
    "00",
    -6.911260604858398
   ],
   [
    "▁time",
    -6.911927700042725
   ],
   [
    "ells",
    -6.912189483642578
   ],
   [
    "Th",
    -6.912555694580078
   ],
   [
    "nine",
    -6.913269519805908
   ],
   [
    "▁down",
    -6.9132819175720215
   ],
   [
    "▁date",
    -6.913668632507324
   ],
   [
    "ade",
    -6.913940906524658
   ],
   [
    "ain",
    -6.9162397384643555
   ],
   [
    "▁things",
    -6.9163665771484375
   ],
   [
    "14",
    -6.917515277862549
   ],
   [
    "▁fa",
    -6.919339179992676
   ],
   [
    "hi",
    -6.9199724197387695
   ],
   [
    "now",
    -6.920880317687988
   ],
   [
    "mps",
    -6.92203426361084
   ],
   [
    "59",
    -6.9277777671813965
   ],
   [
    "ri",
    -6.9280781745910645
   ],
   [
    "▁picked",
    -6.929917812347412
   ],
   [
    "▁key",
    -6.930756568908691
   ],
   [
    "ap",
    -6.932346820831299
   ],
   [
    "les",
    -6.932880401611328
   ],
   [
    "▁cou",
    -6.935056209564209
   ],
   [
    "▁In",
    -6.935308456420898
   ],
   [
    "▁too",
    -6.937345027923584
   ],
   [